{
  "$schema": "../schemas/status.schema.json",
  "version": "1.0.0",
  "lastUpdated": "2025-01-01T00:00:00Z",
  "description": "游늵 Meta-status views for BlackRoad OS constellation",
  "summary": {
    "overall": {
      "status": "ready",
      "emoji": "游릭",
      "message": "BlackRoad OS constellation is operational"
    }
  },
  "subsystems": {
    "core": {
      "name": "Core Platform",
      "status": "ready",
      "emoji": "游릭",
      "components": {
        "blackroad-os-core": {
          "status": "ready",
          "emoji": "游릭",
          "version": "1.0.0",
          "lastDeployed": "2025-01-01T00:00:00Z"
        },
        "blackroad-os-web": {
          "status": "ready",
          "emoji": "游릭",
          "version": "1.0.0",
          "lastDeployed": "2025-01-01T00:00:00Z"
        },
        "blackroad-os-api": {
          "status": "ready",
          "emoji": "游릭",
          "version": "1.0.0",
          "lastDeployed": "2025-01-01T00:00:00Z"
        },
        "blackroad-os-api-gateway": {
          "status": "ready",
          "emoji": "游릭",
          "version": "1.0.0",
          "lastDeployed": "2025-01-01T00:00:00Z"
        }
      },
      "links": {
        "dashboard": "https://prism.blackroad.os/core",
        "docs": "https://docs.blackroad.os/core"
      }
    },
    "infrastructure": {
      "name": "Infrastructure",
      "status": "ready",
      "emoji": "游릭",
      "components": {
        "blackroad-os-infra": {
          "status": "ready",
          "emoji": "游릭",
          "version": "1.0.0",
          "lastDeployed": "2025-01-01T00:00:00Z"
        },
        "blackroad-os-operator": {
          "status": "ready",
          "emoji": "游릭",
          "version": "1.0.0",
          "lastDeployed": "2025-01-01T00:00:00Z"
        }
      },
      "links": {
        "dashboard": "https://prism.blackroad.os/infra",
        "docs": "https://docs.blackroad.os/infra"
      }
    },
    "observability": {
      "name": "Observability",
      "status": "in-progress",
      "emoji": "游리",
      "components": {
        "blackroad-os-prism-console": {
          "status": "in-progress",
          "emoji": "游리",
          "version": "0.9.0",
          "lastDeployed": "2025-01-01T00:00:00Z",
          "notes": "Dashboard features under development"
        },
        "blackroad-os-archive": {
          "status": "ready",
          "emoji": "游릭",
          "version": "1.0.0",
          "lastDeployed": "2025-01-01T00:00:00Z"
        }
      },
      "links": {
        "dashboard": "https://prism.blackroad.os",
        "docs": "https://docs.blackroad.os/observability"
      }
    },
    "packs": {
      "name": "Packs",
      "status": "in-progress",
      "emoji": "游리",
      "components": {
        "blackroad-os-pack-finance": {
          "status": "experimental",
          "emoji": "游",
          "version": "0.1.0",
          "complianceSensitive": true,
          "notes": "Early development phase"
        },
        "blackroad-os-pack-legal": {
          "status": "experimental",
          "emoji": "游",
          "version": "0.1.0",
          "complianceSensitive": true,
          "notes": "Early development phase"
        },
        "blackroad-os-pack-education": {
          "status": "in-progress",
          "emoji": "游리",
          "version": "0.5.0",
          "notes": "Active development"
        },
        "blackroad-os-pack-infra-devops": {
          "status": "in-progress",
          "emoji": "游리",
          "version": "0.5.0",
          "notes": "Active development"
        },
        "blackroad-os-pack-creator-studio": {
          "status": "experimental",
          "emoji": "游",
          "version": "0.1.0",
          "notes": "Concept validation phase"
        }
      },
      "links": {
        "dashboard": "https://prism.blackroad.os/packs",
        "docs": "https://docs.blackroad.os/packs"
      }
    },
    "support": {
      "name": "Support Services",
      "status": "ready",
      "emoji": "游릭",
      "components": {
        "blackroad-os-brand": {
          "status": "ready",
          "emoji": "游릭",
          "version": "1.0.0"
        },
        "blackroad-os-docs": {
          "status": "ready",
          "emoji": "游릭",
          "version": "1.0.0"
        },
        "blackroad-os-home": {
          "status": "ready",
          "emoji": "游릭",
          "version": "1.0.0",
          "lastDeployed": "2025-01-01T00:00:00Z"
        },
        "blackroad-os-research": {
          "status": "experimental",
          "emoji": "游",
          "version": "0.1.0",
          "notes": "R&D repository - always experimental"
        }
      },
      "links": {
        "docs": "https://docs.blackroad.os",
        "home": "https://blackroad.os"
      }
    },
    "meta": {
      "name": "Meta-Orchestration",
      "status": "ready",
      "emoji": "游릭",
      "components": {
        "blackroad-os-master": {
          "status": "ready",
          "emoji": "游릭",
          "version": "1.0.0",
          "notes": "This repository"
        }
      },
      "links": {
        "docs": "https://docs.blackroad.os/master"
      }
    }
  },
  "environments": {
    "dev": {
      "name": "Development",
      "status": "ready",
      "emoji": "游릭",
      "url": "https://dev.blackroad.os"
    },
    "staging": {
      "name": "Staging",
      "status": "ready",
      "emoji": "游릭",
      "url": "https://staging.blackroad.os"
    },
    "prod": {
      "name": "Production",
      "status": "ready",
      "emoji": "游릭",
      "url": "https://blackroad.os"
    }
  },
  "links": {
    "prism": "https://prism.blackroad.os",
    "operator": "https://operator.blackroad.os",
    "archive": "https://archive.blackroad.os",
    "docs": "https://docs.blackroad.os",
    "home": "https://blackroad.os"
  }
}
